{
  "$schema": "https://json-schema.org/draft/2020-12/schema",
  "$id": "https://kp-hackathon/schema/runbook.schema.json",
  "title": "Runbook",
  "description": "A cached, replayable procedure. Produced by hand (M1) or distilled from a winning trajectory (M3), executed by RunbookExecutor. RECONCILED at H+1: the action/arguments model comes from the shipped implementation in src/runbook_voice/runbooks.py, which this schema documents rather than competes with. Keep the two in step - if you change one, change the other.",
  "type": "object",
  "required": ["id", "name", "version", "slots", "steps"],
  "properties": {
    "id": { "type": "string", "minLength": 1 },
    "name": { "type": "string", "minLength": 1, "description": "Human-readable title." },
    "version": {
      "type": "string",
      "minLength": 1,
      "description": "String, not integer - Runbook.from_dict coerces with str()."
    },
    "description": {
      "type": "string",
      "minLength": 10,
      "description": "What this runbook does, in one sentence. The semantic matcher searches against this, so describe the TASK, not the implementation."
    },
    "guidance": {
      "type": "object",
      "additionalProperties": false,
      "description": "Parent-learned instructions retained with the executable runbook: what evidence-backed behavior to repeat and what failed or unsafe behavior to avoid.",
      "required": ["do", "avoid"],
      "properties": {
        "do": { "type": "array", "minItems": 1, "items": { "type": "string", "minLength": 1 } },
        "avoid": { "type": "array", "minItems": 1, "items": { "type": "string", "minLength": 1 } }
      }
    },
    "utterance_examples": {
      "type": "array",
      "items": { "type": "string" },
      "minItems": 1,
      "description": "Phrasings that should match. Also the source of truth for the rehearsal script - a presenter improvising a phrasing the matcher never saw is how demos die."
    },
    "slots": {
      "type": "array",
      "description": "Values supplied at replay time. The dialogue layer asks for missing ones in declaration order.",
      "items": { "$ref": "#/$defs/slot" }
    },
    "steps": {
      "type": "array",
      "minItems": 1,
      "description": "Dispatched in order to the persistent runner. Stop on first failure - no implicit retries.",
      "items": { "$ref": "#/$defs/step" }
    }
  },
  "$defs": {
    "slot": {
      "type": "object",
      "required": ["name", "prompt"],
      "properties": {
        "name": {
          "type": "string",
          "pattern": "^[A-Za-z_][A-Za-z0-9_]*$",
          "description": "Referenced in step arguments as {{name}}."
        },
        "prompt": {
          "type": "string",
          "minLength": 1,
          "description": "GRAFTED AT RECONCILIATION. Spoken aloud when this slot is unfilled, so it must be a question a person would actually ask - 'How many people?' not 'the party size'. The shipped model's `description` is documentation and is not askable."
        },
        "type": {
          "enum": ["string", "integer", "number", "boolean", "object", "array"],
          "default": "string",
          "description": "Mirrors SlotType. A step argument that is exactly {{slot}} preserves this type; embedded in a larger string it becomes text."
        },
        "required": { "type": "boolean", "default": true },
        "description": { "type": "string" },
        "default": { "description": "Any JSON value. Must satisfy `type`." },
        "example": { "type": "string" }
      }
    },
    "step": {
      "type": "object",
      "required": ["id", "action"],
      "properties": {
        "id": { "type": "string", "minLength": 1 },
        "action": {
          "type": "string",
          "minLength": 1,
          "description": "Namespaced verb dispatched to the runner, e.g. restaurant.search. Deliberately abstract: no URLs, no CSS selectors. Selectors baked into a runbook break the first time the provider ships a redesign, and a synthesized runbook full of them would be unmaintainable."
        },
        "arguments": {
          "type": "object",
          "description": "Passed to the runner after {{slot}} substitution. Substitution is recursive through nested objects and arrays."
        },
        "description": { "type": "string" },
        "irreversible": {
          "type": "boolean",
          "default": false,
          "description": "INVARIANT 1. True for anything with an out-of-box side effect: bookings, charges, sent messages. The executor routes these through the confirmation gate, and branches must never run them."
        },
        "confirmation_prompt": {
          "type": "string",
          "description": "Spoken readback before an irreversible step. Supports {{slot}} templating - the executor substitutes before handing it to the gate, and an unresolvable reference fails closed. Must name specifics (what, when, how many); 'shall I proceed?' is not acceptable."
        }
      },
      "allOf": [
        {
          "if": {
            "properties": { "irreversible": { "const": true } },
            "required": ["irreversible"]
          },
          "then": {
            "required": ["confirmation_prompt"],
            "$comment": "GRAFTED AT RECONCILIATION. Structural, not advisory: a runbook that books without a spoken gate is invalid rather than a code-review catch. The executor already fails closed when the gate is missing; this closes the same hole at the document level."
          }
        }
      ]
    }
  }
}
